row_id,doc_id,sent_id,text_raw,text_norm,quarter_end,cik,prev_text_raw,prev_text_norm,text_len_chars,short_sentence,heuristic_needs_context,proxy_label_main,proxy_flag_mixed_ab,proxy_c_subtype,legacy_hint_impact,legacy_hint_remediation,legacy_hint_attestation,legacy_hint_find_opinion,legacy_hint_find_remedia_header,legacy_hint_remedia_start_seq,legacy_ab,legacy_negative,split,pred_label,prob_ISSUE,prob_REMEDIATION,prob_OTHER,prob_max,margin_top2,review_flag,auto_accept,model_version,label_main,flag_mixed_ab,flag_needs_context,c_subtype,annotator,label_version,note
8,0001478454_2019_4,20,"the remediation actions include. restricting user access of individuals able to make manual journal entries, (ii) ensuring the completeness of manual journal entries included in the review through a review of a system generated file maintenance report over manual journal entries, (iii) ensuring accurate and appropriate documentation is retained to support the journal entry.",the remediation actions include restricting user access of individuals able to make manual journal entries ii ensuring the completeness of manual journal entries included in the review through a review of a system generated file maintenance report over manual journal entries iii ensuring accurate and appropriate documentation is retained to support the journal entry,2019-12-31,1478454,"50 table of contents remediation management has implemented and continues to implement measures designed to ensure that control deficiencies contributing to the material weakness are remediated so that these controls are designed, implemented and operating effectively.",<num> table of contents remediation management has implemented and continues to implement measures designed to ensure that control deficiencies contributing to the material weakness are remediated so that these controls are designed implemented and operating effectively,368,0,0,REMEDIATION,0,other,0,1,0,False,True,19.0,0,0,trainval,REMEDIATION,0.0581076938061531,0.8084819152282333,0.1334103909656135,0.8084819152282333,0.6750715242626197,0,1,e5_logreg,REMEDIATION,0,0,other,codex_remediation_worker_batch_020,guideline_v1_1_remediation_reaudit_round3,
918,0001494259_2022_4,9,the previously identified cargurus control deficiencies in logical access and change management have been remediated as of year-end.,the previously identified cargurus control deficiencies in logical access and change management have been remediated as of year end,2022-12-31,1494259,"the control deficiencies which, in the aggregate, were assessed as a material weakness during the second quarter ended june 30, 2022 have not yet been fully remediated.",the control deficiencies which in the aggregate were assessed as a material weakness during the second quarter ended <month> <num> <year> have not yet been fully remediated,131,1,0,REMEDIATION,0,other,0,1,0,False,True,8.0,0,0,trainval,REMEDIATION,0.1761186807807498,0.4963230550841064,0.3275582641351436,0.4963230550841064,0.1687647909489628,1,0,e5_logreg,OTHER,0,0,status,codex_remediation_worker_batch_020,guideline_v1_1_remediation_reaudit_round3,remediation completion status only
932,0001494259_2022_4,23,"management, with the oversight of the audit committee of our board of directors, evaluated the material weakness identified during the second quarter of 2022, and implemented a remediation plan to address the material weakness and enhance our control environment.",management with the oversight of the audit committee of our board of directors evaluated the material weakness identified during the second quarter of <year> and implemented a remediation plan to address the material weakness and enhance our control environment,2022-12-31,1494259,114 remediation plan we and our board of directors are committed to maintaining a strong internal control environment.,<num> remediation plan we and our board of directors are committed to maintaining a strong internal control environment,261,0,0,REMEDIATION,0,other,0,1,0,False,True,8.0,0,0,trainval,REMEDIATION,0.0607832776862545,0.4874562483463222,0.4517604739674231,0.4874562483463222,0.0356957743788991,1,0,e5_logreg,REMEDIATION,0,0,other,codex_remediation_worker_batch_020,guideline_v1_1_remediation_reaudit_round3,
936,0001494259_2022_4,27,implementing robust review controls over user access and change management for relevant financial systems; .,implementing robust review controls over user access and change management for relevant financial systems,2022-12-31,1494259,our remediation measures are ongoing and include the following.,our remediation measures are ongoing and include the following,105,1,0,REMEDIATION,0,other,0,1,0,False,False,8.0,0,0,trainval,REMEDIATION,0.0320420188879074,0.9401204542134316,0.0278375268986607,0.9401204542134316,0.9080784353255242,0,1,e5_logreg,REMEDIATION,0,0,other,codex_remediation_worker_batch_020,guideline_v1_1_remediation_reaudit_round3,
937,0001494259_2022_4,28,"implementing effective review of journal entries and account reconciliations, and other financial statement close analyses and processes; .",implementing effective review of journal entries and account reconciliations and other financial statement close analyses and processes,2022-12-31,1494259,implementing robust review controls over user access and change management for relevant financial systems; .,implementing robust review controls over user access and change management for relevant financial systems,135,1,0,REMEDIATION,0,other,0,1,0,False,False,8.0,0,0,trainval,REMEDIATION,0.0732993401021179,0.8983132959680317,0.0283873639298504,0.8983132959680317,0.8250139558659138,0,1,e5_logreg,REMEDIATION,0,0,other,codex_remediation_worker_batch_020,guideline_v1_1_remediation_reaudit_round3,
939,0001494259_2022_4,30,enhancing evidence retained which supports the operating effectiveness of controls; .,enhancing evidence retained which supports the operating effectiveness of controls,2022-12-31,1494259,implementing controls to address the inability to rely on information from the it systems; .,implementing controls to address the inability to rely on information from the it systems,82,1,0,REMEDIATION,0,other,0,1,0,False,False,8.0,0,0,trainval,REMEDIATION,0.0236328968757662,0.7616958319535709,0.2146712711706628,0.7616958319535709,0.5470245607829081,1,0,e5_logreg,REMEDIATION,0,0,other,codex_remediation_worker_batch_020,guideline_v1_1_remediation_reaudit_round3,
941,0001494259_2022_4,32,implementation of controls at the corporate level to reduce the risk of material misstatement related to caroffer financial statements and disclosures; .,implementation of controls at the corporate level to reduce the risk of material misstatement related to caroffer financial statements and disclosures,2022-12-31,1494259,engaging internal and external resources to assist with remediation ; .,engaging internal and external resources to assist with remediation,150,0,0,OTHER,1,background,1,1,0,False,False,8.0,1,0,trainval,REMEDIATION,0.4492714101907791,0.4851814195601237,0.0655471702490972,0.4851814195601237,0.0359100093693445,1,0,e5_logreg,REMEDIATION,0,0,other,codex_remediation_worker_batch_020,guideline_v1_1_remediation_reaudit_round3,
942,0001494259_2022_4,33,hiring additional qualified sox-focused personnel to provide additional capacity and expertise to enhance our it control environment; and .,hiring additional qualified sox focused personnel to provide additional capacity and expertise to enhance our it control environment and,2022-12-31,1494259,implementation of controls at the corporate level to reduce the risk of material misstatement related to caroffer financial statements and disclosures; .,implementation of controls at the corporate level to reduce the risk of material misstatement related to caroffer financial statements and disclosures,136,1,0,REMEDIATION,0,other,0,1,0,False,False,8.0,0,0,trainval,REMEDIATION,0.011738737293022,0.9557513752213994,0.0325098874855786,0.9557513752213994,0.9232414877358208,0,1,e5_logreg,REMEDIATION,0,0,other,codex_remediation_worker_batch_020,guideline_v1_1_remediation_reaudit_round3,
